{
  "schema_version": "mstr.candidate.v1",
  "candidate_id": "qwen2.5-coder-1.5b",
  "upstream_id": "Qwen/Qwen2.5-Coder-1.5B",
  "upstream_revision": "df3ce67c0e24480f20468b6ef2894622d69eb73b",
  "candidate_role": "control",
  "status": "static_qualified",
  "rights": {
    "decision": "pass_permissive",
    "license_name": "Apache-2.0",
    "terms_urls": [
      "https://huggingface.co/Qwen/Qwen2.5-Coder-1.5B/blob/df3ce67c0e24480f20468b6ef2894622d69eb73b/LICENSE",
      "https://www.apache.org/licenses/LICENSE-2.0.txt",
      "https://huggingface.co/Qwen/Qwen2.5-Coder-1.5B/tree/df3ce67c0e24480f20468b6ef2894622d69eb73b",
      "https://huggingface.co/api/models/Qwen/Qwen2.5-Coder-1.5B"
    ],
    "personal_use": "yes",
    "commercial_use": "yes",
    "modification": "yes",
    "fine_tuning": "yes",
    "quantization": "yes",
    "derivative_redistribution": "yes",
    "account_gate_required": false,
    "clickthrough_gate_required": false,
    "end_user_separate_license_required": false,
    "field_or_scale_restrictions": [],
    "rationale": "Upstream repository publishes the model under Apache-2.0 (machine-readable `license: apache-2.0` metadata in README/model card and HF model tags). Apache-2.0 grants personal/commercial use, modification, fine-tuning, quantization/conversion, and derivative redistribution with notice preservation. A verbatim Apache-2.0 LICENSE file exists in the pinned repository tree."
  },
  "architecture": {
    "family": "qwen2",
    "parameter_count_total": 1543714304,
    "parameter_count_active": 1543714304,
    "tokenizer_id": "Qwen/Qwen2.5-Coder-1.5B tokenizer (Qwen2Tokenizer, includes FIM control tokens)",
    "tokenizer_revision": "df3ce67c0e24480f20468b6ef2894622d69eb73b",
    "vision_components": [],
    "fim_capability": "yes"
  },
  "runtime_support_notes": [
    "GGUF conversion expected viable via llama.cpp-class runtimes (to be proven by later artifact tasks).",
    "CPU-only basic operation targeted per universal-laptop invariant."
  ],
  "quantization_support_notes": [
    "Q4-class quantization targeted <=3GB primary artifact budget (FR-003); actual viability deferred to measured artifact tasks."
  ],
  "source_urls": [
    "https://huggingface.co/Qwen/Qwen2.5-Coder-1.5B/tree/df3ce67c0e24480f20468b6ef2894622d69eb73b",
    "https://huggingface.co/Qwen/Qwen2.5-Coder-1.5B/blob/df3ce67c0e24480f20468b6ef2894622d69eb73b/config.json",
    "https://huggingface.co/Qwen/Qwen2.5-Coder-1.5B/raw/df3ce67c0e24480f20468b6ef2894622d69eb73b/README.md",
    "https://huggingface.co/api/models/Qwen/Qwen2.5-Coder-1.5B"
  ]
}
