{
  "schema_version": "mstr.candidate.v1",
  "candidate_id": "ministral-3-3b",
  "upstream_id": "mistralai/Ministral-3-3B-Base-2512",
  "upstream_revision": "6f9c4b12a95b139af68670a6713616b757923735",
  "candidate_role": "foundation",
  "status": "static_qualified",
  "rights": {
    "decision": "pass_permissive",
    "license_name": "Apache-2.0",
    "terms_urls": [
      "https://www.apache.org/licenses/LICENSE-2.0.txt",
      "https://huggingface.co/mistralai/Ministral-3-3B-Base-2512/tree/6f9c4b12a95b139af68670a6713616b757923735",
      "https://huggingface.co/api/models/mistralai/Ministral-3-3B-Base-2512/revision/6f9c4b12a95b139af68670a6713616b757923735"
    ],
    "personal_use": "yes",
    "commercial_use": "yes",
    "modification": "yes",
    "fine_tuning": "yes",
    "quantization": "yes",
    "derivative_redistribution": "yes",
    "account_gate_required": false,
    "clickthrough_gate_required": false,
    "end_user_separate_license_required": false,
    "field_or_scale_restrictions": [],
    "rationale": "Pinned public repository metadata declares Apache-2.0 with no observed account or clickthrough gate. The same repository carries the tokenizer and integrated vision component under the declared repository license. B006 revalidated the exact pinned revision through metadata only; any later weight-access task must re-verify all required components immediately before acquisition."
  },
  "architecture": {
    "family": "mistral3",
    "parameter_count_total": 4251743232,
    "parameter_count_active": null,
    "tokenizer_id": "mistralai/Ministral-3-3B-Base-2512 tokenizer (LlamaTokenizerFast)",
    "tokenizer_revision": "6f9c4b12a95b139af68670a6713616b757923735",
    "vision_components": [
      "integrated pixtral vision encoder (model_type=pixtral, hidden_size=1024)"
    ],
    "fim_capability": "no"
  },
  "runtime_support_notes": [
    "Pinned Hugging Face safetensors metadata reports exactly 4,251,743,232 serialized parameters. The current model-card family description separately reports approximately 3.4B language-model parameters plus 0.4B vision-encoder parameters; B006 treats these as different accounting surfaces rather than contradictory revision identities.",
    "GGUF/runtime viability remains unproved until the later runtime/artifact tasks; multimodal serving cost must remain separate from text-only universal-laptop comparisons."
  ],
  "quantization_support_notes": [
    "No quantized artifact was downloaded or produced. Q4-class fit inside the primary artifact budget remains a later measured-artifact question."
  ],
  "source_urls": [
    "https://huggingface.co/mistralai/Ministral-3-3B-Base-2512/tree/6f9c4b12a95b139af68670a6713616b757923735",
    "https://huggingface.co/mistralai/Ministral-3-3B-Base-2512/blob/6f9c4b12a95b139af68670a6713616b757923735/config.json",
    "https://huggingface.co/api/models/mistralai/Ministral-3-3B-Base-2512/revision/6f9c4b12a95b139af68670a6713616b757923735"
  ]
}
