{
  "schema_version": "mstr.candidate.v1",
  "candidate_id": "qwen3.5-4b",
  "upstream_id": "Qwen/Qwen3.5-4B-Base",
  "upstream_revision": "1001bb4d826a52d1f399e183466143f4da7b741b",
  "candidate_role": "foundation",
  "status": "static_qualified",
  "rights": {
    "decision": "pass_permissive",
    "license_name": "Apache-2.0",
    "terms_urls": [
      "https://huggingface.co/Qwen/Qwen3.5-4B-Base/blob/1001bb4d826a52d1f399e183466143f4da7b741b/LICENSE",
      "https://www.apache.org/licenses/LICENSE-2.0.txt",
      "https://huggingface.co/Qwen/Qwen3.5-4B-Base/tree/1001bb4d826a52d1f399e183466143f4da7b741b",
      "https://huggingface.co/api/models/Qwen/Qwen3.5-4B-Base/revision/1001bb4d826a52d1f399e183466143f4da7b741b"
    ],
    "personal_use": "yes",
    "commercial_use": "yes",
    "modification": "yes",
    "fine_tuning": "yes",
    "quantization": "yes",
    "derivative_redistribution": "yes",
    "account_gate_required": false,
    "clickthrough_gate_required": false,
    "end_user_separate_license_required": false,
    "field_or_scale_restrictions": [],
    "rationale": "Upstream repository publishes the model under Apache-2.0 (machine-readable `license: apache-2.0` metadata in README/model card and HF model tags). Apache-2.0 grants personal/commercial use, modification, fine-tuning, quantization/conversion, and derivative redistribution with notice preservation. A verbatim Apache-2.0 LICENSE file exists in the pinned repository tree. Component rights (FR-016): tokenizer files and any vision-encoder weights ship inside the same pinned repository tree and are covered by the identical declared license verified at the pinned revision; no third-party component with independent terms is used. Any weight-access task must re-verify all components at acquisition time."
  },
  "architecture": {
    "family": "qwen3_5",
    "parameter_count_total": 4659865088,
    "parameter_count_active": 4659865088,
    "tokenizer_id": "Qwen/Qwen3.5-4B-Base tokenizer (Qwen2Tokenizer, BPE)",
    "tokenizer_revision": "1001bb4d826a52d1f399e183466143f4da7b741b",
    "vision_components": [
      "integrated qwen3_5 vision encoder (same repo/LICENSE, Apache-2.0)"
    ],
    "fim_capability": "yes"
  },
  "runtime_support_notes": [
    "GGUF conversion expected viable via llama.cpp-class runtimes (to be proven by later artifact tasks).",
    "CPU-only basic operation targeted per universal-laptop invariant.",
    "Multimodal architecture: serving may require text-only pathway validation during runtime qualification."
  ],
  "quantization_support_notes": [
    "Q4-class quantization targeted <=3GB primary artifact budget (FR-003); actual viability deferred to measured artifact tasks."
  ],
  "source_urls": [
    "https://huggingface.co/Qwen/Qwen3.5-4B-Base/tree/1001bb4d826a52d1f399e183466143f4da7b741b",
    "https://huggingface.co/Qwen/Qwen3.5-4B-Base/blob/1001bb4d826a52d1f399e183466143f4da7b741b/config.json",
    "https://huggingface.co/Qwen/Qwen3.5-4B-Base/raw/1001bb4d826a52d1f399e183466143f4da7b741b/README.md",
    "https://huggingface.co/api/models/Qwen/Qwen3.5-4B-Base/revision/1001bb4d826a52d1f399e183466143f4da7b741b"
  ]
}
