{
  "schema_version": "mstr.candidate.v1",
  "candidate_id": "lfm2.5-2.6b-reference",
  "upstream_id": "LiquidAI/LFM2.5-2.6B-Base",
  "upstream_revision": "c57bdaed1ef166fe3095dda07f4a5e789ad5321e",
  "candidate_role": "reference_only",
  "status": "reference_only",
  "rights": {
    "decision": "fail",
    "license_name": "LFM Open License v1.0",
    "terms_urls": [
      "https://huggingface.co/LiquidAI/LFM2.5-2.6B-Base/tree/c57bdaed1ef166fe3095dda07f4a5e789ad5321e",
      "https://www.liquid.ai/lfm-license"
    ],
    "personal_use": "yes",
    "commercial_use": "yes",
    "modification": "yes",
    "fine_tuning": "yes",
    "quantization": "yes",
    "derivative_redistribution": "yes",
    "account_gate_required": false,
    "clickthrough_gate_required": false,
    "end_user_separate_license_required": false,
    "field_or_scale_restrictions": [
      "Free commercial rights end when company annual revenue reaches or exceeds USD 10,000,000; continued commercial use then requires a separate commercial license."
    ],
    "rationale": "LFM Open License v1.0 otherwise grants broad use, modification, fine-tuning and redistribution rights, but its USD 10M annual-revenue threshold is a scale restriction. MSTR primary rights admission requires no field or scale restriction, so the record is reference-only."
  },
  "architecture": {
    "family": "lfm2",
    "parameter_count_total": 2697198592,
    "parameter_count_active": 2697198592,
    "tokenizer_id": "LiquidAI/LFM2.5-2.6B-Base tokenizer",
    "tokenizer_revision": "c57bdaed1ef166fe3095dda07f4a5e789ad5321e",
    "vision_components": [],
    "fim_capability": "unknown"
  },
  "runtime_support_notes": [
    "Pre-trained text-only on-device-oriented base with 131072-token context; runtime compatibility remains B009 work."
  ],
  "quantization_support_notes": [
    "No quantized artifact was downloaded or produced."
  ],
  "source_urls": [
    "https://huggingface.co/LiquidAI/LFM2.5-2.6B-Base/tree/c57bdaed1ef166fe3095dda07f4a5e789ad5321e",
    "https://www.liquid.ai/lfm-license",
    "https://www.liquid.ai/pricing"
  ]
}
