{
  "schema_version": "mstr.candidate.v1",
  "candidate_id": "smollm3-3b",
  "upstream_id": "HuggingFaceTB/SmolLM3-3B-Base",
  "upstream_revision": "d78a42f79198603e614095753484a04c10c2b940",
  "candidate_role": "foundation",
  "status": "static_qualified",
  "rights": {
    "decision": "pass_permissive",
    "license_name": "Apache-2.0",
    "terms_urls": [
      "https://www.apache.org/licenses/LICENSE-2.0.txt",
      "https://huggingface.co/HuggingFaceTB/SmolLM3-3B-Base/tree/d78a42f79198603e614095753484a04c10c2b940",
      "https://huggingface.co/api/models/HuggingFaceTB/SmolLM3-3B-Base"
    ],
    "personal_use": "yes",
    "commercial_use": "yes",
    "modification": "yes",
    "fine_tuning": "yes",
    "quantization": "yes",
    "derivative_redistribution": "yes",
    "account_gate_required": false,
    "clickthrough_gate_required": false,
    "end_user_separate_license_required": false,
    "field_or_scale_restrictions": [],
    "rationale": "Upstream repository publishes the model under Apache-2.0 (machine-readable `license: apache-2.0` metadata in README/model card and HF model tags). Apache-2.0 grants personal/commercial use, modification, fine-tuning, quantization/conversion, and derivative redistribution with notice preservation. CAVEAT: no standalone LICENSE text file exists in the pinned repository tree; the declaration is carried by README front matter and HF license tags at the pinned revision. Exact pinned-revision URLs are cited as terms evidence. Any weight-access task MUST re-verify current terms immediately before acquisition (FR-018/T021 landscape rescan also re-checks this). Component rights (FR-016): tokenizer files and any vision-encoder weights ship inside the same pinned repository tree and are covered by the identical declared license verified at the pinned revision; no third-party component with independent terms is used. Any weight-access task must re-verify all components at acquisition time."
  },
  "architecture": {
    "family": "smollm3",
    "parameter_count_total": 3075098624,
    "parameter_count_active": 3075098624,
    "tokenizer_id": "HuggingFaceTB/SmolLM3-3B-Base tokenizer (PreTrainedTokenizerFast)",
    "tokenizer_revision": "d78a42f79198603e614095753484a04c10c2b940",
    "vision_components": [],
    "fim_capability": "no"
  },
  "runtime_support_notes": [
    "GGUF conversion expected viable via llama.cpp-class runtimes (to be proven by later artifact tasks).",
    "CPU-only basic operation targeted per universal-laptop invariant."
  ],
  "quantization_support_notes": [
    "Q4-class quantization targeted <=3GB primary artifact budget (FR-003); actual viability deferred to measured artifact tasks."
  ],
  "source_urls": [
    "https://huggingface.co/HuggingFaceTB/SmolLM3-3B-Base/tree/d78a42f79198603e614095753484a04c10c2b940",
    "https://huggingface.co/HuggingFaceTB/SmolLM3-3B-Base/blob/d78a42f79198603e614095753484a04c10c2b940/config.json",
    "https://huggingface.co/HuggingFaceTB/SmolLM3-3B-Base/raw/d78a42f79198603e614095753484a04c10c2b940/README.md",
    "https://huggingface.co/api/models/HuggingFaceTB/SmolLM3-3B-Base"
  ]
}
