{
  "schema_version": "mstr.candidate.v1",
  "candidate_id": "comparison-qwen3-4b-instruct-2507",
  "upstream_id": "Qwen/Qwen3-4B-Instruct-2507",
  "upstream_revision": "cdbee75f17c01a7cc42f958dc650907174af0554",
  "candidate_role": "comparison",
  "status": "discovered",
  "rights": {
    "decision": "pass_permissive",
    "license_name": "Apache-2.0",
    "terms_urls": [
      "https://huggingface.co/Qwen/Qwen3-4B-Instruct-2507/tree/cdbee75f17c01a7cc42f958dc650907174af0554",
      "https://huggingface.co/api/models/Qwen/Qwen3-4B-Instruct-2507",
      "https://www.apache.org/licenses/LICENSE-2.0.txt"
    ],
    "personal_use": "yes",
    "commercial_use": "yes",
    "modification": "yes",
    "fine_tuning": "yes",
    "quantization": "yes",
    "derivative_redistribution": "yes",
    "account_gate_required": false,
    "clickthrough_gate_required": false,
    "end_user_separate_license_required": false,
    "field_or_scale_restrictions": [],
    "rationale": "Apache-2.0 declared via HF machine-readable license tags and README at the pinned revision; public ungated repo. Comparison points never become primary backbone candidates; full LICENSE-file verification would be required before any artifact use."
  },
  "architecture": {
    "family": "qwen3",
    "parameter_count_total": 4022468096,
    "parameter_count_active": 4022468096,
    "tokenizer_id": "Qwen2Tokenizer BPE (same tokenizer family as Qwen3-4B-Base control)",
    "tokenizer_revision": "cdbee75f17c01a7cc42f958dc650907174af0554",
    "vision_components": [],
    "fim_capability": "yes"
  },
  "runtime_support_notes": [
    "Comparison purpose: Post-trained counterpart of the Qwen3-4B-Base control; isolates instruct-tuning delta at identical architecture/scale.",
    "NOT a foundation winner; recorded for context only."
  ],
  "quantization_support_notes": [],
  "source_urls": [
    "https://huggingface.co/Qwen/Qwen3-4B-Instruct-2507/tree/cdbee75f17c01a7cc42f958dc650907174af0554",
    "https://huggingface.co/api/models/Qwen/Qwen3-4B-Instruct-2507"
  ]
}
